{
  "schema_version": "1.0",
  "record_type": "text-contract",
  "lesson_id": "replace-me",
  "status": "draft",
  "generated_at": "1970-01-01T00:00:00Z",
  "mode": "ppt-only",
  "artifacts": {
    "teaching-design": {"sha256": "0000000000000000000000000000000000000000000000000000000000000000", "ids": ["OBJ-01", "MAT-01", "TASK-01", "ASM-01"]},
    "teaching-script": {"sha256": "0000000000000000000000000000000000000000000000000000000000000000", "ids": ["OBJ-01", "TASK-01", "ASM-01", "ANS-01", "SCRIPT-01"]}
  },
  "objectives": [{"objective_id": "OBJ-01"}],
  "materials": [{"material_id": "MAT-01", "source_ids": ["replace-source-id"], "rights_status": "unknown"}],
  "tasks": [{"task_id": "TASK-01", "objective_ids": ["OBJ-01"], "material_ids": ["MAT-01"], "assessment_ids": ["ASM-01"], "ppt_required": true}],
  "assessments": [{"assessment_id": "ASM-01", "task_id": "TASK-01", "objective_ids": ["OBJ-01"], "answer_id": "ANS-01"}],
  "answers": [{"answer_id": "ANS-01", "assessment_id": "ASM-01"}],
  "scripts": [{"script_id": "SCRIPT-01", "task_id": "TASK-01"}]
}
